<?xml version='1.0'?><!DOCTYPE Annotation PUBLIC "//GENIA//DTD GENIA ANNOTATION EVENT 2.0//EN_Modified" "../ModifiedGENIAtypes/Modified_GENIA_event_20.dtd"><Annotation annotates="http://www.ncbi.nlm.nih.gov/entrez/eutils/efetch.fcgi?db=pubmed&amp;retmode=xml&amp;rettype=medline&amp;id=10064064" created="13/01/2007" creator="Junko Matsuura"><PubmedArticleSet><PubmedArticle><MedlineCitation>
<PMID>10064064</PMID>
<Article>
<ArticleTitle>
<sentence id="S1"><cons id="T1" lex="(AND AML_protein Ets_protein)" sem="(AND Protein_family_or_group Protein_family_or_group)"><frag id="F1"><term id="A1" sem="Protein_molecule">AML</term></frag> and <frag id="F2"><term id="A2" sem="Protein_molecule">Ets</term></frag> <frag id="F3">proteins</frag></cons> regulate the <term id="T2" lex="I_alpha1_germ-line_promoter" sem="DNA_domain_or_region">I alpha1 germ-line promoter</term>.</sentence>
<event id="E1">
<type class="Regulation"/>
<theme idref="T2"/>
<cause idref="A1"/>
<clue>AML and Ets proteins <clueType>regulate</clueType> the I alpha1 germ-line promoter.</clue>
</event>
<event id="E2">
<type class="Regulation"/>
<theme idref="T2"/>
<cause idref="A2"/>
<clue>AML and Ets proteins <clueType>regulate</clueType> the I alpha1 germ-line promoter.</clue>
</event>
</ArticleTitle>
<Abstract>
<AbstractText>
<sentence id="S2">The <term id="T3" lex="_switch_recombination" sem="Other"><term id="T4" lex="immunoglobulin_heavy_chain" sem="Protein_family_or_group">immunoglobulin heavy chain</term> (<term id="T5" lex="IgH" sem="Protein_family_or_group">IgH</term>) class switch recombination</term> of <term id="T6" lex="B_lymphocyte" sem="Cell_natural">B lymphocytes</term> preferentially targets <term id="A3" sem="DNA_domain_or_region">unrearranged <term id="T7" lex="IgH_gene" sem="DNA_family_or_group">IgH genes</term></term> that have already been rendered transcriptionally active.</sentence>
<event KT="Other" id="E3">
<type class="DNA_recombination"/>
<theme idref="T5"/>
<clue>The immunoglobulin heavy chain (IgH) <clueType>class switch recombination</clueType> <clueLoc>of B lymphocytes</clueLoc> preferentially targets unrearranged IgH genes that have already been rendered transcriptionally active.</clue>
</event>
<event KT="Other" id="E4">
<type class="Positive_regulation"/>
<theme idref="A3"/>
<clue>The immunoglobulin heavy chain (IgH) class switch recombination of B lymphocytes preferentially targets unrearranged IgH genes that have already been <clueType>rendered transcriptionally active</clueType>.</clue>
</event>
<event KT="Fact" id="E105">
<type class="Positive_regulation"/>
<theme idref="E4"/>
<cause idref="E3"/>
<clue>The immunoglobulin heavy chain (IgH) class switch recombination of B lymphocytes preferentially <clueType>targets</clueType> unrearranged IgH genes that have already been rendered transcriptionally active.</clue>
</event>
<sentence id="S3">Transcription of the <term id="T9" lex="germ-line_IgH_gene" sem="DNA_family_or_group">germ-line <term id="T10" lex="IgH_gene" sem="DNA_family_or_group">IgH genes</term></term> is controlled by <term id="T11" lex="intervening_(I)_region" sem="DNA_domain_or_region">intervening (I) regions</term> upstream of their switch regions.</sentence>
<event KT="Other" id="E5">
<type class="Transcription"/>
<theme idref="T9"/>
<clue><clueType>Transcription</clueType> <linkTheme>of</linkTheme> the germ-line IgH genes is controlled by intervening (I) regions upstream of their switch regions.</clue>
</event>
<event KT="Fact" id="E6">
<type class="Regulation"/>
<theme idref="E5"/>
<cause idref="T11"/>
<clue>Transcription of the germ-line IgH genes is <clueType>controlled</clueType> <linkCause>by</linkCause> intervening (I) regions upstream of their switch regions.</clue>
</event>
<sentence id="S4">The <term id="A4" sem="DNA_domain_or_region">I alpha1 promoter</term> activates transcription of the <term id="T12" lex="human_germ-line_C_alpha1_gene" sem="DNA_domain_or_region">human germ-line C alpha1 gene</term> for <term id="T13" lex="IgA1" sem="Protein_molecule">IgA1</term> and mediates the <term id="T14" lex="transforming_growth_factor_(TGF)-beta1_responsiveness" sem="Other"><term id="T15" lex="transforming_growth_factor_(TGF)-beta1" sem="Protein_molecule">transforming growth factor (TGF)-beta1</term> responsiveness</term> of this locus.</sentence>
<event KT="Other" id="E7">
<type class="Transcription"/>
<theme idref="T12"/>
<clue>The I alpha1 promoter activates <clueType>transcription</clueType> <linkTheme>of</linkTheme> the human germ-line C alpha1 gene for IgA1 and mediates the transforming growth factor (TGF)-beta1 responsiveness of this locus.</clue>
</event>
<event KT="Fact" id="E8">
<type class="Positive_regulation"/>
<theme idref="E7"/>
<cause idref="A4"/>
<clue>The I alpha1 promoter <clueType>activates</clueType> transcription of the human germ-line C alpha1 gene for IgA1 and mediates the transforming growth factor (TGF)-beta1 responsiveness of this locus.</clue>
</event>
<event KT="Other" id="E9">
<type class="Regulation"/>
<theme idref="T11"/>
<cause idref="T15"/>
<clue>The I alpha1 promoter activates transcription of the human germ-line C alpha1 gene for IgA1 and mediates the transforming growth factor (TGF)-beta1 <clueType>responsiveness</clueType> <linkTheme>of</linkTheme> <corefTheme>this locus.</corefTheme></clue>
</event>
<event KT="Fact" id="E10">
<type class="Positive_regulation"/>
<theme idref="E9"/>
<cause idref="A4"/>
<clue>The I alpha1 promoter activates transcription of the human germ-line C alpha1 gene for IgA1 and <clueType>mediates</clueType> the transforming growth factor (TGF)-beta1 responsiveness of this locus.</clue>
</event>
<sentence id="S5">Here we show that the <term id="A7" sem="DNA_domain_or_region">I alpha1 promoter</term> contains several binding sites for the <term id="T16" lex="AML/PEBP2/CBF_family_of_transcription_factor" sem="Protein_family_or_group"><term id="T17" lex="AML" sem="Protein_family_or_group">AML</term>/PEBP2/CBF family of <term id="T18" lex="transcription_factor" sem="Protein_family_or_group">transcription factors</term></term> and that <cons id="T19" lex="(AND AML_protein Ets_protein)" sem="(AND Protein_family_or_group Protein_family_or_group)"><frag id="F4"><term id="A5" sem="Protein_molecule">AML</term></frag> and <frag id="F5"><term id="A6" sem="Protein_molecule">Ets</term></frag> <frag id="F6">proteins</frag></cons> are major regulators of the <cons id="T20" lex="(AND basal_promoter_activity TGF-beta-inducible_promoter_activity)" sem="(AND Other Other)"><frag id="F7">basal</frag> and <frag id="F8"><term id="A9" sem="Protein_molecule">TGF-beta</term>-inducible</frag> <frag id="F9">promoter activity</frag></cons>.</sentence>
<event KT="Other" id="E11">
<type class="Positive_regulation"/>
<theme idref="A7"/>
<cause idref="A9"/>
<clue>Here we show that the I alpha1 promoter contains several binding sites for the AML/PEBP2/CBF family of transcription factors and that AML and Ets proteins are major regulators of the basal and TGF-beta-<clueType>inducible</clueType> <corefTheme>promoter</corefTheme> activity.</clue>
</event>
<event KT="Other" id="E12">
<type class="Regulation"/>
<theme idref="A7"/>
<cause idref="A5"/>
<clue>Here we show that the I alpha1 promoter contains several binding sites for the AML/PEBP2/CBF family of transcription factors and that AML and Ets proteins are major <clueType>regulators</clueType> <linkTheme>of</linkTheme> the basal and TGF-beta-inducible promoter activity.</clue>
</event>
<event KT="Analysis" id="E13">
<type class="Regulation"/>
<theme idref="E11"/>
<cause idref="A5"/>
<clue>Here we <clueKT>show</clueKT> that the I alpha1 promoter contains several binding sites for the AML/PEBP2/CBF family of transcription factors and that AML and Ets proteins are major <clueType>regulators</clueType> <linkTheme>of</linkTheme> the basal and TGF-beta-inducible promoter activity.</clue>
</event>
<event KT="Other" id="E14">
<type class="Regulation"/>
<theme idref="A7"/>
<cause idref="A6"/>
<clue>Here we show that the I alpha1 promoter contains several binding sites for the AML/PEBP2/CBF family of transcription factors and that AML and Ets proteins are major <clueType>regulators</clueType> <linkTheme>of</linkTheme> the basal and TGF-beta-inducible promoter activity.</clue>
</event>
<event KT="Analysis" id="E15">
<type class="Regulation"/>
<theme idref="E11"/>
<cause idref="A6"/>
<clue>Here we <clueKT>show</clueKT> that the I alpha1 promoter contains several binding sites for the AML/PEBP2/CBF family of transcription factors and that AML and Ets proteins are major <clueType>regulators</clueType> <linkTheme>of</linkTheme> the basal and TGF-beta-inducible promoter activity.</clue>
</event>
<sentence id="S6">Our data constitute a starting point for studies to elucidate the molecular mechanism by which <term id="T21" lex="TGF-beta" sem="Protein_molecule">TGF-beta</term> regulates <term id="T22" lex="IgA_production" sem="Other"><term id="T23" lex="IgA" sem="Protein_family_or_group">IgA</term> production</term>.</sentence>
<event KT="Other" id="E16">
<type class="Gene_expression"/>
<theme idref="T23"/>
<clue>Our data constitute a starting point for studies to elucidate the molecular mechanism by which TGF-beta regulates IgA <clueType>production</clueType>.</clue>
</event>
<event KT="Fact" id="E17">
<type class="Regulation"/>
<theme idref="E16"/>
<cause idref="T21"/>
<clue>Our data constitute a starting point for studies to elucidate the molecular mechanism by which TGF-beta <clueType>regulates</clueType> IgA production.</clue>
</event>
</AbstractText>
</Abstract></Article></MedlineCitation></PubmedArticle></PubmedArticleSet></Annotation>
