<?xml version='1.0'?><!DOCTYPE Annotation PUBLIC "//GENIA//DTD GENIA ANNOTATION EVENT 2.0//EN_Modified" "../ModifiedGENIAtypes/Modified_GENIA_event_20.dtd"><Annotation annotates="http://www.ncbi.nlm.nih.gov/entrez/eutils/efetch.fcgi?db=pubmed&amp;retmode=xml&amp;rettype=medline&amp;id=7769834" created="04/10/2006" creator="Junko Matsuura"><PubmedArticleSet><PubmedArticle><MedlineCitation>
<PMID>7769834</PMID>
<Article>
<ArticleTitle>
<sentence id="S1">Activation of <term id="T1" lex="pp90rsk" sem="Protein_molecule">pp90rsk</term> and <term id="T2" lex="early_growth_response-1_gene_expression" sem="Other"><term id="T3" lex="early_growth_response-1_gene" sem="DNA_domain_or_region">early growth response-1 gene</term> expression</term> by <term id="T4" lex="pokeweed_mitogen" sem="Protein_molecule">pokeweed mitogen</term> in <term id="T5" lex="human_B_cell" sem="Cell_natural">human B cells</term>.</sentence>
<event KT="Other" id="E2">
<type class="Gene_expression"/>
<theme idref="T3"/>
<clue>Activation of pp90rsk and early growth response-1 gene <clueType>expression</clueType> by pokeweed mitogen in human B cells.</clue>
</event>
<event KT="Investigation" id="E3">
<type class="Positive_regulation"/>
<theme idref="T1"/>
<cause idref="T4"/>
<clue><clueType>Activation</clueType> <linkTheme>of</linkTheme> pp90rsk and early growth response-1 gene expression <linkCause>by</linkCause> pokeweed mitogen <clueLoc>in human B cells</clueLoc>.</clue>
</event>
<event KT="Investigation" id="E4">
<type class="Positive_regulation"/>
<theme idref="E2"/>
<cause idref="T4"/>
<clue><clueType>Activation</clueType> <linkTheme>of</linkTheme> pp90rsk and early growth response-1 gene expression <linkCause>by</linkCause> pokeweed mitogen <clueLoc>in human B cells</clueLoc>.</clue>
</event>
</ArticleTitle>
<Abstract>
<AbstractText>
<sentence id="S2">The present studies have examined the effects of <term id="T6" lex="pokeweed_mitogen" sem="Protein_molecule">pokeweed mitogen</term> (<term id="T7" lex="PWM" sem="Protein_molecule">PWM</term>) on the induction of <term id="T8" lex="early_growth_response-1_gene" sem="DNA_domain_or_region">early growth response-1 gene</term> (<term id="T9" lex="EGR-1" sem="DNA_domain_or_region">EGR-1</term>) in <term id="T10" lex="normal_human_B_cell" sem="Cell_natural">normal <term id="T11" lex="human_B_cell" sem="Cell_natural">human B cells</term></term>.</sentence>
<event KT="Other" id="E5">
<type class="Positive_regulation"/>
<theme idref="T9"/>
<clue>The present studies have examined the effects of pokeweed mitogen (PWM) on the <clueType>induction</clueType> <linkTheme>of</linkTheme> early growth response-1 gene (EGR-1) <clueLoc>in normal human B cells</clueLoc>.</clue>
</event>
<event KT="Investigation" id="E6" uncertainty="doubtful">
<type class="Regulation"/>
<theme idref="E5"/>
<cause idref="T7"/>
<clue>The present studies have <clueKT>examined</clueKT> the <clueType>effects</clueType> <linkCause>of</linkCause> pokeweed mitogen (PWM) <linkTheme>on</linkTheme> the induction of early growth response-1 gene (EGR-1) in normal human B cells.</clue>
</event>
<sentence id="S3"><term id="T12" lex="PWM" sem="Protein_molecule">PWM</term> regulates <term id="T13" lex="EGR-1_gene_expression" sem="Other"><term id="T14" lex="EGR-1" sem="DNA_domain_or_region">EGR-1</term> gene expression</term> by both <cons id="T15" lex="(AND transcriptional_mechanism post-transcriptional_mechanism)" sem="(AND Other Other)"><frag id="F1">transcriptional</frag> and <frag id="F2">post-transcriptional</frag> <frag id="F3">mechanisms</frag></cons>.</sentence>
<event KT="Other" id="E7">
<type class="Gene_expression"/>
<theme idref="T14"/>
<clue>PWM regulates EGR-1 gene <clueType>expression</clueType> by both transcriptional and post-transcriptional mechanisms.</clue>
</event>
<event KT="Fact" id="E8">
<type class="Regulation"/>
<theme idref="E7"/>
<cause idref="T12"/>
<clue>PWM <clueType>regulates</clueType> EGR-1 gene expression by both <clueType>transcriptional and post-transcriptional</clueType> mechanisms.</clue>
</event>
<sentence id="S4"><term id="T16" lex="transient_transfection_assay" sem="Other">Transient transfection assays</term> with <term id="T17" lex="EGR-1_promoter_fragment" sem="DNA_molecule"><term id="T18" lex="EGR-1" sem="DNA_domain_or_region">EGR-1</term> promoter fragments</term> linked to the <term id="T19" lex="chloramphenicol_acetyltransferase_(CAT)_gene" sem="DNA_domain_or_region"><term id="T20" lex="chloramphenicol_acetyltransferase" sem="Protein_molecule">chloramphenicol acetyltransferase</term> (<term id="T21" lex="CAT" sem="Protein_molecule">CAT</term>) gene</term> demonstrated that <term id="T22" lex="PWM" sem="Protein_molecule">PWM</term> induced <term id="T23" lex="EGR-1_transcription" sem="Other"><term id="T24" lex="EGR-1" sem="DNA_domain_or_region">EGR-1</term> transcription</term> is conferred by the <term id="T25" lex="CArG_motif" sem="DNA_domain_or_region">CArG motif</term> <term id="A50" sem="DNA_domain_or_region">(<term id="T26" lex="C_C[AT]6GG" sem="DNA_domain_or_region">C C[AT]6GG</term>) in the <term id="T27" lex="EGR-1_promoter" sem="DNA_domain_or_region"><term id="T28" lex="EGR-1" sem="DNA_domain_or_region">EGR-1</term> promoter</term>.</term></sentence>
<event KT="Other" id="E9">
<type class="Transcription"/>
<theme idref="T24"/>
<clue>Transient transfection assays with EGR-1 promoter fragments linked to the chloramphenicol acetyltransferase (CAT) gene demonstrated that PWM induced EGR-1 <clueType>transcription</clueType> is conferred by the CArG motif (C C[AT]6GG) in the EGR-1 promoter.</clue>
</event>
<event KT="Other" id="E10">
<type class="Positive_regulation"/>
<theme idref="E9"/>
<cause idref="T22"/>
<clue>Transient transfection assays with EGR-1 promoter fragments linked to the chloramphenicol acetyltransferase (CAT) gene demonstrated that PWM <clueType>induced</clueType> EGR-1 transcription is conferred by the CArG motif (C C[AT]6GG) in the EGR-1 promoter.</clue>
</event>
<event KT="Analysis" id="E11">
<type class="Positive_regulation"/>
<theme idref="E10"/>
<cause idref="A50"/>
<clue><clueExperiment>Transient transfection assays with EGR-1 promoter fragments linked to the chloramphenicol acetyltransferase (CAT) gene</clueExperiment> <clueKT>demonstrated</clueKT> that PWM induced EGR-1 transcription is <clueType>conferred</clueType> <linkCause>by</linkCause> the CArG motif (C C[AT]6GG) in the EGR-1 promoter.</clue>
<comment>TPS: A50</comment></event>
<sentence id="S5">The results further demonstrated the activation of <term id="T29" lex="S6_kinase" sem="Protein_molecule">S6 kinase</term> (<term id="T30" lex="pp90rsk" sem="Protein_molecule">pp90rsk</term>), evidenced by <term id="T31" lex="phosphorylation" sem="Other">phosphorylation</term> of <term id="T32" lex="S6" sem="Protein_molecule">S6</term> and <term id="T33" lex="serum_response_factor_(SRF)_peptide" sem="Peptide">serum response factor (SRF) peptides</term>, in <term id="T34" lex="PWM_treated_B_cell" sem="Cell_cultured"><term id="T35" lex="PWM" sem="Protein_molecule">PWM</term> treated <term id="A1" sem="Cell_natural">B cells</term></term>.</sentence>
<event KT="Analysis" id="E12">
<type class="Positive_regulation"/>
<theme idref="T30"/>
<clue>The results further <clueKT>demonstrated</clueKT> the <clueType>activation</clueType> <linkTheme>of</linkTheme> S6 kinase (pp90rsk), <clueKT>evidenced</clueKT> by phosphorylation of S6 and serum response factor (SRF) peptides, in PWM treated B cells.</clue>
</event>
<event id="E13">
<type class="Protein_amino_acid_phosphorylation"/>
<theme idref="T32"/>
<clue>The results further demonstrated the activation of S6 kinase (pp90rsk), evidenced by <clueType>phosphorylation</clueType> <linkTheme>of</linkTheme> S6 and serum response factor (SRF) peptides, <clueLoc>in PWM treated B cells</clueLoc>.</clue>
</event>
<event id="E14">
<type class="Protein_amino_acid_phosphorylation"/>
<theme idref="T33"/>
<clue>The results further demonstrated the activation of S6 kinase (pp90rsk), evidenced by <clueType>phosphorylation</clueType> <linkTheme>of</linkTheme> S6 and serum response factor (SRF) peptides, <clueLoc>in PWM treated B cells</clueLoc>.</clue>
</event>
<event KT="Method" id="E15">
<type class="Artificial_process"/>
<theme idref="T35"/>
<theme idref="A1"/>
<clue>The results further demonstrated the activation of S6 kinase (pp90rsk), evidenced by phosphorylation of S6 and serum response factor (SRF) peptides, in PWM <clueType>treated</clueType> B cells.</clue>
</event>
<sentence id="S6">Taken together, these findings suggest that <term id="T36" lex="PWM" sem="Protein_molecule">PWM</term> is able to initiate an <term id="T37" lex="intracytoplasmic_signalling_cascade" sem="Other">intracytoplasmic signalling cascade</term> and <term id="T38" lex="EGR-1_induction" sem="Other"><term id="T39" lex="EGR-1" sem="DNA_domain_or_region">EGR-1</term> induction</term> in <term id="T40" lex="normal_human_B_cell" sem="Cell_natural">normal <term id="T41" lex="human_B_cell" sem="Cell_natural">human B cells</term></term>.</sentence>
<event CL="L2" KT="Analysis" id="E16" uncertainty="probable">
<type class="Positive_regulation"/>
<theme idref="T37"/>
<cause idref="T36"/>
<clue>Taken together, these findings <clueKT>suggest</clueKT> that PWM is <clueCL>able</clueCL> to <clueType>initiate</clueType> an intracytoplasmic signalling cascade and EGR-1 induction <clueLoc>in normal human B cells</clueLoc>.</clue>
</event>
<event KT="Other" id="E17" uncertainty="probable">
<type class="Positive_regulation"/>
<theme idref="T39"/>
<cause idref="T36"/>
<clue>Taken together, these findings suggest that PWM is able to initiate an intracytoplasmic signalling cascade and EGR-1 <clueType>induction</clueType> <clueLoc>in normal human B cells</clueLoc>.</clue>
</event>
</AbstractText>
</Abstract></Article></MedlineCitation></PubmedArticle></PubmedArticleSet></Annotation>
