<?xml version='1.0'?><!DOCTYPE Annotation PUBLIC "//GENIA//DTD GENIA ANNOTATION EVENT 2.0//EN_Modified" "../ModifiedGENIAtypes/Modified_GENIA_event_20.dtd"><Annotation annotates="http://www.ncbi.nlm.nih.gov/entrez/eutils/efetch.fcgi?db=pubmed&amp;retmode=xml&amp;rettype=medline&amp;id=2122173" created="11/01/2007" creator="Noriko Katsu"><PubmedArticleSet><PubmedArticle><MedlineCitation>
<PMID>2122173</PMID>
<Article>
<ArticleTitle>
<sentence id="S1"><term id="T1" lex="interferon-gamma" sem="Protein_molecule">Interferon-gamma</term> and the <term id="T2" lex="sexual_dimorphism" sem="Other">sexual dimorphism</term> of <term id="T3" lex="autoimmunity" sem="Other">autoimmunity</term>.</sentence>
</ArticleTitle>
<Abstract>
<AbstractText>
<sentence id="S2">The <term id="T4" lex="sexual_difference" sem="Other">sexual difference</term> in the incidence of <term id="T5" lex="autoimmune_disease" sem="Other">autoimmune diseases</term> has remained an enigma for many years.</sentence>
<sentence id="S3">In the examination of the induction of <term id="T6" lex="autoimmunity" sem="Other">autoimmunity</term> in <term id="T7" lex="transgenic_mice" sem="Multicellular_organism_genetically_modified">transgenic mice</term>, evidence has been obtained further implicating the <term id="T8" lex="lymphokine" sem="Protein_family_or_group">lymphokine</term> <term id="T9" lex="interferon-gamma" sem="Protein_molecule">interferon-gamma</term> in the etiology of <term id="T10" lex="autoimmunity" sem="Other">autoimmunity</term>.</sentence>
<event KT="Investigation" id="E1" uncertainty="doubtful">
<type class="Positive_regulation"/>
<theme idref="T6"/>
<clue>In the <clueKT>examination</clueKT> of the <clueType>induction</clueType> <linkTheme>of</linkTheme> autoimmunity <clueLoc>in transgenic mice</clueLoc>, evidence has been obtained further implicating the lymphokine interferon-gamma in the etiology of autoimmunity.</clue>
</event>
<event KT="Analysis" id="E2">
<type class="Regulation"/>
<theme idref="T10"/>
<cause idref="T9"/>
<clue>In the examination of the induction of autoimmunity in transgenic mice, <clueKT>evidence</clueKT> has been obtained further <clueType><clueKT>implicating</clueKT></clueType> the <corefCause>lymphokine</corefCause> interferon-gamma <linkTheme>in</linkTheme> the etiology of autoimmunity.</clue>
</event>
<sentence id="S4"><term id="T11" lex="sex_steroid_regulation" sem="Other"><term id="A1" sem="Organic_compound_other">Sex steroid</term> regulation</term> of the production of this molecule, as well as other <term id="T12" lex="cytokine" sem="Protein_molecule">cytokines</term>, may help explain the gender-specific differences in the <term id="T13" lex="immune_system" sem="Body_region">immune system</term>, including <term id="T14" lex="autoimmunity" sem="Other">autoimmunity</term>.</sentence>
<event KT="Other" id="E3">
<type class="Regulation"/>
<theme idref="E4"/>
<cause idref="A1"/>
<clue>Sex steroid <clueType>regulation</clueType> <linkTheme>of</linkTheme> the production of this molecule, as well as other cytokines, may help explain the gender-specific differences in the immune system, including autoimmunity.</clue>
</event>
<event KT="Other" id="E6">
<type class="Regulation"/>
<theme idref="E5"/>
<cause idref="A1"/>
<clue>Sex steroid <clueType>regulation</clueType> <linkTheme>of</linkTheme> the production of this molecule, as well as other cytokines, may help explain the gender-specific differences in the immune system, including autoimmunity.</clue>
</event>
<event KT="Other" id="E4">
<type class="Gene_expression"/>
<theme idref="T9"/>
<clue>Sex steroid regulation of the <clueType>production</clueType> <linkTheme>of</linkTheme> <corefTheme>this molecule</corefTheme>, as well as other cytokines, may help explain the gender-specific differences in the immune system, including autoimmunity.</clue>
</event>
<event KT="Other" id="E5">
<type class="Gene_expression"/>
<theme idref="T12"/>
<clue>Sex steroid regulation of the <clueType>production</clueType> <linkTheme>of</linkTheme> this molecule, as well as other cytokines, may help explain the gender-specific differences in the immune system, including autoimmunity.</clue>
</event>
</AbstractText>
</Abstract></Article></MedlineCitation></PubmedArticle></PubmedArticleSet></Annotation>
